{
  "schemaVersion": 1,
  "id": "exploration-field-guide",
  "sourceLocale": "en",
  "kind": "hub",
  "tags": [
    "getting-started",
    "exploration"
  ],
  "categories": [
    "getting-started"
  ],
  "relations": [
    {
      "kind": "zone",
      "id": "Zone1_Tier2",
      "role": "primary"
    },
    {
      "kind": "zone",
      "id": "Zone2_Tier2",
      "role": "guide"
    },
    {
      "kind": "zone",
      "id": "Zone3_Tier2",
      "role": "guide"
    },
    {
      "kind": "zone",
      "id": "Zone4_Tier4",
      "role": "guide"
    }
  ]
}
