{
  "schemaVersion": 1,
  "id": "howling-sands-guide",
  "sourceLocale": "en",
  "kind": "zone",
  "tags": [
    "exploration",
    "materials",
    "creatures"
  ],
  "categories": [
    "zones"
  ],
  "relations": [
    {
      "kind": "zone",
      "id": "Zone2_Tier2",
      "role": "primary"
    },
    {
      "kind": "zone",
      "id": "Zone2_Tier3",
      "role": "guide"
    },
    {
      "kind": "item",
      "id": "Ore_Thorium_Sandstone",
      "role": "guide"
    },
    {
      "kind": "entity",
      "id": "Hyena",
      "role": "guide"
    }
  ]
}
