{
  "schemaVersion": 1,
  "id": "chapter-one",
  "sourceLocale": "en",
  "kind": "guide",
  "tags": [
    "exploration",
    "getting-started"
  ],
  "categories": [
    "chapters"
  ],
  "relations": [
    {
      "kind": "zone",
      "id": "ForgottenTemple",
      "role": "primary"
    },
    {
      "kind": "item",
      "id": "GoblinLab_Generator",
      "role": "guide"
    },
    {
      "kind": "wiki",
      "id": "goblin-lab-guide",
      "role": "related"
    }
  ]
}
